date,enddate,location,city,state,presenter,piece,role,notes
10/10/2022,,Virginia Tech University,Blacksburg,VA,Freshman Composition Class presentation,,,
10/8/2022,,Art Rat Studios,Roanoke,VA,Art Rat Studios,improv,improviser,with Kyle Hutchins
10/6/2022,,Virginia Tech University,Blacksburg,VA,Composition Seminar,,,
9/30/2022,,NYU / Columbia University,New York,NY,IRCAM Forum,quartet,composer,
7/10/2022,,Kühlspot Social Club,Berlin,DE,Kühlspot Social Club,improv,improviser,with Nina Guo
7/9/2022,,K77 Studio,Berlin,DE,K77 Studio,improv,improviser,with Nina Guo
7/9/2022,,Catalyst & Technical University,Berlin,DE,Catalyst & Technical University,FluComa,Workshop,
7/3/2022,,Limerick University,Limerick,Ireland,ICMC,FluComa,Workshop,
7/1/2022,,New River Studios,London,UK,SKRONK,improv,improviser,with Kyle Hutchins & Seth Davis
6/18/2022,,AME,Huddersfield,UK,AME,improv,improviser,with PA Tremblay and Emil Karlsen
6/3/2022,6/4/2022,University of Sussex,Brighton,UK,University of Sussex,FluComa,Workshop,
6/2/2022,,The Rose Hill,Brighton,UK,University of Sussex,improv,improviser,with Paul Keene
5/19/2022,,Soda Acústic,Barcelona,ES,Soda Acústic,improv,improviser,"with Ángel Faraldo, Clara Lai, & Ferran Fages"
5/13/2022,5/20/2022,Universitat Pompeu Fabra,Barcelona,ES,Phonos Foundation,Residency,,
5/12/2022,,Soda Acústic,Barcelona,ES,Soda Acústic,improv,improviser,with El Pricto and Luis Erades
5/5/2022,,Mise-en Space,New York,NY,Mise-en ensemble,still motion,composer,Josh Perry
4/14/2022,4/15/2022,Columbia University,New York,NY,Computer Music Center,FluCoMa,Workshop,
4/11/2022,4/13/2022,University of Pennsylvania,Philadelphia,PA,Music Department,FluCoMa,Workshop,
4/9/2022,4/10/2022,Harvestworks,New York,NY,Harvestworks,FluCoMa,Workshop,
4/6/2022,4/7/2022,Peabody Conservatory,Baltimore,MD,Computer Music Department,FluCoMa,Workshop,
4/5/2022,,Red Room,Baltimore,MD,Red Room,FluCoMa,Workshop,
4/3/2022,,Carnegie Mellon University,Pittsburgh,PA,IDeATe Lab,improv,,with Ben Opie
4/2/2022,4/3/2022,Carnegie Mellon University,Pittsburgh,PA,IDeATe Lab,FluCoMa,Workshop,
4/1/2022,,Western Michigan University,Kalamazoo,MI,SEAMUS,FluCoMa Presentation,,
3/17/2022,,MIR,Oslo,Norway,NOTAM,improv,improviser,with Inga Margrete Aas
3/14/2022,3/18/2022,NOTAM,Oslo,Norway,NOTAM,FluComa,Workshop,
2/26/2022,,University of Huddersfield,Huddersfield,UK,Creative Coding Lab,Artist Presentation,,
2/25/2022,,University of Huddersfield,Huddersfield,UK,Electric Spring Festival,improv,improviser,with Mark Hanslip
1/20/2022,,University of Victoria (remote),Victoria,Canada,FluCoMa,,Workshop,
1/18/2022,,UC San Diego (remote),San Deigo,CA,Composition Seminar,,Presentation on my creative work,
1/17/2022,1/18/2021,UC San Diego (remote),San Deigo,CA,FluCoMa,,Workshop,
1/15/2022,1/16/2021,University of Washington (DXARTS) (remote),Seattle,WA,FluCoMa,,Workshop,
1/12/2022,,University of Victoria (remote),Victoria,Canada,Composition Seminar,,Presentation on my creative work,
12/3/2021,,Massechusettes Institute of Technology,Cambridge,MA,FluCoMa,,Workshop,
12/3/2021,12/4/2021,New England Conservatory,Boston,MA,FluCoMa,,Workshop,
12/2/2021,,Berklee School of Music,Boston,MA,FluCoMa,,Workshop,
12/2/2021,,Mise-en Space,New York,NY,Mise-en ensemble,still motion,composer,Josh Perry
12/2/2021,,Harvard University,Cambridge,MA,FluCoMa,,Workshop,
12/1/2021,,Columbia & Bell Labs,New York,NY,FluCoMa,,Presentation on my creative work,
11/30/2021,,New York University,New York,NY,FluCoMa,,Presentation on my creative work,
11/29/2021,,Princeton University,Princeton,NJ,FluCoMa,,Workshop,
11/24/2021,11/26/2021,McGill (CIRMMT),Montreal,Canada,FluCoMa,,Workshop,
11/17/2021,,University of Chicago (remote),Chicago ,IL,Brad Spiers Music and AI,,Guest Lecture,
11/8/2021,11/12/2021,Hogeschool voor de Kunsten,Utrecht,NL,FluCoMa,,Workshop,
10/16/2021,,Arizona State University,Phoenix,AZ,Southwest Electronic Music Festival,improv,improviser,Binary Canary
10/16/2021,,Arizona State University,Phoenix,AZ,FluCoMa,,Workshop,
10/10/2021,,University of Chicago,Chicago,IL,FluCoMa,,Workshop,
10/9/2021,,School at the Art Institute of Chicago,Chicago,IL,FluCoMa,,Workshop,
10/8/2021,,DePaul University,Chicago,IL,Composition Seminar,,Presentation on my creative work,
10/7/2021,,University of Chicago,Chicago,IL,Digital Media Workshop,,FluCoMa Presentatation,
10/3/2021,,,Chicago,IL,Ear Taxi Festival,FEATHERMUCKER,composer / performer,The Dream Songs Project
10/3/2021,,Constellation,Chicago,IL,Ear Taxi Festival,feed,composer / performer,Ted Moore & Ben Roidl-Ward
10/2/2021,,University of Chicago,Chicago,IL,Ear Taxi Festival,lacunae,composer,Wet Ink
7/27/2021,,Internet,Santiago,Chile,International Computer Music Conference,hollow,composer / performer,Binary Canary
7/23/2021,,,Città di Castello,Italy,ilSUONO,noise/gate,composer,Giacomo Piermatti
6/21/2021,,New England Conservatory (remote),Boston,MA,SICPP,Artist Presentation,Artist,
5/20/2021,,Villa Aurelia,Rome,Italy,American Academy in Rome,improv,improviser,Ted Moore & Fabrizio Spera
12/11/2020,,National Sawdust,New York,NY,National Sawdust,triangle,compoer,JACK Quartet
11/20/2020,,Internet,Charlotte,NC,Charlotte New Music,squal,composer,Erin Rogers
8/18/2020,,mise-en place,New York,NY,mise-en ensemble,still motion,composer,Josh Perry
6/9/2020,,Victoria Bach Festival,Victoria,TX,Victoria Bach Festival,for line upon line,composer,line upon line percussion
3/29/2020,,Internet,Chicago,IL,Civic Orchestra of Chicago,hold,composer,
2/28/2020,2/29/2020,University of Chicago,Chicago,IL,CHIMEFest 2020: CIRCULATIONS,Director,Director,
2/28/2020,,University of Chicago,Chicago,IL,CHIMEFest 2020: CIRCULATIONS,Interference Patters: analysis of interacting feedbacks in hollow,Researcher,
1/19/2020,1/25/2020,"Gray Center, University of Chicago",Chicago,IL,Gray Center,MUSIC'S OVER: Listening with Peter Ablinger,Technical Support,"Wet Ink, Aperiodic"
1/18/2020,,Slate Arts,Chicago,IL,Ted Moore,improv,improviser,with Weston Olencki
12/12/2019,,University of Chicago,Chicago,IL,"Arts, Sciences, and Culture Initiative",Artist Presentation,Artist,
12/1/2019,,BEAST,Birmingham,UK,Chris Goodchild,fiery walls,composer,Chris Goodchild
11/22/2019,,University of Huddersfield,Huddersfield,England,Flucoma Plenary,Preserving User-Defined Expression through Dimensionality Reduction,Researcher,
11/18/2019,,Hundred Years Gallery,London,England,Hundred Years Gallery,improv,improviser,"with Benedict Taylor, Tonia Ko, Olivier Stankeweicz"
11/15/2019,,de Roze Tanker,Amsterdam,Netherlands,de Roze Tanker,improv,improviser,with Anne La Berge
11/14/2019,,de Ruimte,Amsterdam,Netherlands,de Ruimte,improv,improviser,"with Anne La Berge, Yung-Tuan Ku"
11/8/2019,,Hochschule für Musik,Freiburg,Germany,Line Upon Line Percussion,tap,composer,Line Upon Line Percussion
11/5/2019,,City University,London,England,Line Upon Line Percussion,tap,composer,Line Upon Line Percussion
11/3/2019,,Constellation,Chicago,IL,Frequency Series,iterative systems,composer improviser,Binary Canary
10/25/2019,,Elastic Arts,Chicago,IL,Sean Hamilton,improv,improviser,sean hamilton
10/21/2019,,Experimental Sound Studio,Chicago,IL,Option Series,improv,improviser,with Kyle Bruckmann and Macie Stewart
10/10/2019,,"MADD Center, University of Chicago",Chicago,IL,Digital Media Workshop,Machine Learning Applications for Live Computer Music Performance,Researcher,
10/9/2019,,Que4 Radio,Chicago,IL,Que4 Radio,improv,improviser,with Emerson Hunton
10/4/2019,,Slate Arts,Chicago,IL,Lauren Hayes,improv,improviser,"with Lauren Hayes, Sarah Plum, and Daniel Wyche"
9/25/2019,,Elastic Arts,Chicago,IL,Fulcrum Point New Music,it teaches us that it doesn't exist,"composer, performer",Ted Moore
9/23/2019,,Arete,Brooklyn,NY,Weston Olencki,improv,improviser,with Weston Olencki
8/8/2019,,Center for New Music,San Francisco,CA,Chris Brown,improv,improviser,with Tom Weeks
7/1/2019,,The Walden School,Dublin,NH,Deathstare Duo,crunch,composer,"Dana Jessen, bassoon; Erica Dicker, violin; Ted Moore, electronics"
6/9/2019,,Flea Theater,New York,NY,Talea Ensemble,still motion,composer,Matt Gold
6/9/2019,,Flea Theater,New York,NY,Talea Ensemble,it teaches us that it doesn't exist,"composer, performer",Ted Moore
5/15/2019,,Logan Center for the Arts,Chicago,IL,Sophia Bell,BODYTALK,sound designer,
5/11/2019,,VAMP,Oakland,CA,VAMP,improv,improviser,"Tom Weeks, saxophone; Ted Moore, laptop"
5/2/2019,,Logan Center for the Arts,Chicago,IL,CHIMEFEST,improv,improviser,"Weston Olenki, electronics; Matt Barbier, trombone; Katie Young, bassoon and electronics; Ted Moore, electronics"
5/1/2019,,Logan Center for the Arts,Chicago,IL,CHIMEFEST,Approaches to Live Performance and Composition with Machine Learning and Music Information Retrieval Analysis,Researcher,
4/14/2019,,Elastic Arts,Chicago,IL,Elastic Arts,improv,improviser,"Hannah Judd, cello; Ted Moore, laptop"
4/12/2019,,Hairpin Arts Center,Chicago,IL,~Nois Saxophone Quartet,where is where we are,composer,
4/9/2019,,Elastic Arts,Chicago,IL,Ars Electroacoustica,feed,composer,me and Ben Roidl-Ward
3/31/2019,,Constellation,Chicago,IL,Deathstare Duo,crunch,composer,"Dana Jessen, bassoon; Erica Dicker, violin; Ted Moore, electronics"
3/29/2019,,Elastic Arts,Chicago,IL,Elastic Arts,improv,improviser,"Dana Jessen, bassoon; Erica Dicker, violin; Katie Young, bassoon; Ted Moore, electronics"
3/28/2019,,Elastic Arts,Chicago,IL,Elastic Arts,improv,improviser,"Emerson Hunton, drums; Eric Krouse, piano; Ted Moore, electronics"
3/22/2019,,Guarneri Hall,Chicago,IL,New Music Chicago - Impromptu Fest,it teaches us that it doesn't exist,"composer, performer",
3/22/2019,,Guarneri Hall,Chicago,IL,New Music Chicago - Impromptu Fest,improv,improviser,"Tonia Ko, bubble wrap; Ted Moore, electronics"
3/14/2019,,Parker Jazz Club,Austin,TX,SXSW,tap,composer,Line Upon Line Percussion
3/9/2019,,Central Missouri University,Warrensburg,MO,MOXsonic,improv,improviser,Binary Canary + Sean Hamilton
2/14/2019,,Yale University,New Haven,CT,Center for Collaborative Arts and Media,still motion,composer,Matt Gold
2/9/2019,,University of Virginia,Charlottesville,VA,N_SEME,improv,improviser,Ted Moore & Kyle Hutchins
2/5/2019,,Chicago Symphony Center,Chicago,IL,University of Chicago Music Department,patina,composer,Chicago Civic Orchestra
2/4/2019,,Virginia Tech,Blacksburg,VA,Kyle Hutchins: Faculty Recital,column,"composer, performer",Ted Moore & Kyle Hutchins
2/3/2019,,University of Wisconsin Whitewater,Whitewater,WI,Patti Cudd,still motion,composer,"Patti Cudd, Jeff Harriot"
2/1/2019,,Northwestern University,Evanston,IL,Patti Cudd,still motion,"composer, performer",Patti Cudd
1/12/2019,,First Street Studio,Austin,TX,Line Upon Line Percussion,tap,composer,"Adam, Matt, & Cullen"
12/9/2018,,Logan Center for the Arts,Chicago,IL,University of Chicago Music Department,improv,improviser,"Emerson Hunton, drums; Ted Moore, laptop"
11/28/2018,,Western Michigan University,Kalamazoo,MI,WMU Music Department (Chris Biggs),still motion b,"composer, performer",Ted Moore
11/8/2018,,Bowling Green State University,Bowling Green,OH,SPLICE Festival,hollow,"composer, performer",Ted Moore & Kyle Hutchins
11/2/2018,,Experimental Sound Studio,Chicago,IL,Oscillations Series,feed,"composer, performer","Ben Roidl-Ward, bassoon; Ted Moore, electronics"
10/1/2018,,Mayfield School District,Cleveland,OH,Mayfield School District,Rhythm Pedagogy Workshop,Pedagogue,
9/8/2018,,Aftershock Theater,Pittsburgh,PA,Pittsburgh Festival of New Muisc,FEATHERMUCKER,"composer, performer",me and TDSP
8/9/2018,,The Cube at Virginia Tech,Blacksburg,VA,Spatial Music Workshop,column,"composer, performer",
7/27/2018,,OUTr Spaces,Omaha,NE,Omaha Under the Radar,feedback xii,"composer, performer",
7/27/2018,,OUTr Spaces,Omaha,NE,Omaha Under the Radar,it teaches us that it doesn't exist,"composer, performer",
7/27/2018,,OUTr Spaces,Omaha,NE,Omaha Under the Radar,still motion b,"composer, performer",
7/18/2018,,Abrons Art Center,New York,NY,New York City Electroacoustic Music Festival,still motion,"Composer, performer",Patti Cudd
7/16/2018,,Internationales Musikinstitut Darmstadt,Darmstadt,Germany,Internationales Musikinstitut Darmstadt,feedback viii: hollow,"Composer, performer",Ted Moore & Kyle Hutchins
7/16/2018,,Internationales Musikinstitut Darmstadt,Darmstadt,Germany,Internationales Musikinstitut Darmstadt,improv,improviser,Yung-Tuan Ku
7/12/2018,,Zagreb Academy of Music,Zagreb,Croatia,World Saxophone Congress,feedback viii: hollow,"Composer, performer",Ted Moore & Kyle Hutchins
7/5/2018,,STEIM,Amsterdam,Netherlands,STEIM,improv,improviser,Yung-Tuan Ku
6/16/2018,,The Walden School,Dublin,NH,The Walden School,still motion,"Composer, performer",Matt Gold
6/9/2018,,Mass MoCA,North Adams,MA,Mass MoCA,still motion,"Composer, performer",Matt Gold
5/26/2018,,University of Chicago,Chicago,IL,Carillon Festival,the curve is exponential,Composer,"Joey Brink, carillon"
5/16/2018,,Cafe Mustache,Chicago,IL,Cafe Mustache,improv,Laptop Improviser,"Emerson Hunton, drums; Ted Moore, laptop"
5/12/2018,,University of Chicago,Chicago,IL,UChicago Presents,"feedback vii: speak, contain","composer, performer",Imani Winds
4/21/2018,,Northwestern University,Evanston,IL,NUNC3,feedback viii: hollow,"Composer, Performer",
4/12/2018,4/14/2018,University of Chicago,Chicago,IL,UChicago Presents,Broken Jug,Sound designer,
4/7/2018,,Slate Arts,Chicago,IL,Emerson Hunton,improv,Laptop Improviser,"Emerson Hunton, drums; Ted Moore, laptop"
4/5/2018,,University of Chicago,Chicago,IL,CHIMEFEST,circle,"Composer, Performer","Ted Moore, laptop, lights, tubes; Spektral Quartet"
3/30/2018,,Narloch Piano Studio,Chicago,IL,Riley Nicholson,Feedback X,"Composer, Performer","Ted Moore, eurorack modular synth, lighting design, laptop, no-input mixer, tubes, feedback cymbal"
3/16/2018,,Brandeis University,Waltham,MA,BEAMS Marathon Festival,it teaches us that it doesn't exist,"Composer, Performer","Ted Moore, feedback cymbal"
3/13/2018,,Elastic Arts,Chicago,IL,Ted Moore,improv,"Composer, Performer","Ted Moore, eurorack modular synth, lighting design, laptop, tubes, feedback cymbal; Ben Roidl-Ward, bassoon"
3/10/2018,,Central Missouri University,Warrensburg,MO,MOXsonic,still motion b,"Composer, Performer","Ted Moore, mouth and video"
3/10/2018,,Studio Z,St. Paul,MN,Scott Miller,Solstice Orrery,Video Design,Scott Miller
3/7/2018,,Narloch Piano Studio,Chicago,IL,Binary Canary,improv,,
2/23/2018,,"Chicago, IL",Chicago,IL,Body Milk Tapes,improv,,"Emerson Hunton, drums; Ted Moore, laptop"
2/16/2018,2/17/2018,New York University,New York,NY,Precarious Sounds // Sounding Sanctuary,attackSUSTAINrelease,,
1/29/2018,,Myopic Books,Chicago,IL,Myopic Mondays,improvisation,Laptop Improviser,"Emerson Hunton, drums; Ted Moore, laptop"
12/2/2017,,University of Chicago,Chicago,IL,Nuclear Reactions,the curve is exponential,Composer,"Joey Brink, carillon"
11/5/2017,,University of Chicago,Chicago,IL,New Music Ensemble,still motion,Composer,"John Corkill, percussion"
10/28/2017,,Truman State University,Kirksville,MO,North Star Music Festival,improvisation,"Composer, Performer","Ted Moore, laptop, DMX lights"
10/28/2017,,Truman State University,Kirksville,MO,North Star Music Festival,it teaches us that it doesn't exist,"Composer, Performer","Ted Moore, cymbal"
10/28/2017,,Truman State University,Kirksville,MO,North Star Music Festival,still motion b,"Composer, Performer","Ted Moore, mouth and video"
10/28/2017,,Truman State University,Kirksville,MO,North Star Music Festival,Solstice Orrery,,Scott Miller
10/27/2017,,Truman State University,Kirksville,MO,North Star Music Festival,Guest presentation to composition studio,,
10/27/2017,,Truman State University,Kirksville,MO,North Star Music Festival,improvisation,,"Tim Aubuchon, saxophone; Ted Moore, laptop"
10/5/2017,10/6/2017,Transylvania University,Lexington,KY,Studio 300,attackSUSTAINrelease,,
9/27/2017,,Iowa State University,Ames,IA,Lipa Festival,Solstice Orrery,Video Design,Scott Miller
8/7/2017,8/11/2017,Studio Z,St. Paul,MN,Zeitgeist,Composer Workshop,Composer,Zeitgeist
7/14/2017,,The Walden School,Dublin,NH,Splinter Reeds,"feedback vii: speak, contain",Composer,Splinter Reeds
5/31/2017,,Black Dog Cafe & Bar,St. Paul,MN,Ars Electroacoustica,improvisation,Laptop Improviser,"Ted Moore, laptop; Scott Miller, laptop; Kyle Hutchins, saxophone; Nathan Hanson, saxophone"
5/26/2017,,Fresh Oysters Performance Research,Minneapolis,MN,Skewed Visions,APPETITE,"Composer, Performer","Ted Moore, laptop sound & video design; Charles Campbell, text & movement"
4/22/2017,,Macphail Center for Music,Minneapolis,MN,MacPhail Center for Music,Gymnopedies,"Composer, Performer","Ted Moore, laptop; Andy Myers, glockenspiel; Carlynn Savot, cello"
4/21/2017,,St. Cloud State University,St. Cloud,MN,SEAMUS,APSIS,"Composer, Performer","Ted Moore, laptop & video design; Strains New Music Ensemble (Kyle Hutchins, tenor saxophone; Joey Crane, cello; Patti Cudd, percussion; James DeVoll, flute)"
4/20/2017,,The Nest at The Pickled Loon,St. Cloud,MN,SEAMUS,improvisation,Laptop Improviser,"Ted Moore, laptop; Scott Miller, laptop; Adam Zahller, bass recorder; Kyle Hutchins, saxophone"
4/8/2017,,Spectrum,New York,NY,Reembodied Sound: Transducer Conference,it teaches us that it doesn't exist,"Composer, Performer",
3/19/2017,,House Concert,Minneapolis,MN,Ars Electroacoustica,improvisation,Laptop Improviser,"Ted Moore, laptop; Scott Miller, laptop; Jacqueline Ultan, cello"
2/28/2017,3/3/2017,A-Mill Artist Lofts,Minneapolis,MN,Catherine Dalton,Bluets,Sound Designer,
2/25/2017,,Luther College,Decorah,IA,Iowa Composers Forum,it teaches us that it doesn't exist,"Composer, Performer",
2/10/2017,,Georgia Southern University,Statesboro,GA,Root Signals Electronic Music Festival,feedback IV,"Composer, Performer",
1/19/2017,,Khyber Pass Cafe,St. Paul,MN,Kevin Cosgrove,FEATHERMUCKER,"Composer, Performer","The Dream Songs Project (Alyssa Anderson, soprano; Joseph Spoelstra, guitar), Ted Moore, laptop"
11/29/2016,,Reverie Cafe and Bar,Minneapolis,MN,Ars Electroacoustica,improvisation,improvisor,"Ted Moore, laptop; Pat O'Keefe, clarinet; Scott Miller, laptop"
11/10/2016,,University of Wisconson La Crosse,La Crosse,WI,University of Wisconson La Crosse New Music Festival,feedback iii: air,"Composer, Performer","Ted Moore, laptop, tubes, and video design; Carlynn Savott, cello"
11/10/2016,,University of Wisconson La Crosse,La Crosse,WI,University of Wisconson La Crosse New Music Festival,it teaches us that it doesn't exist,"Composer, Performer","Ted Moore, feedback cymbal"
11/10/2016,,University of Wisconson La Crosse,La Crosse,WI,University of Wisconson La Crosse New Music Festival,"no-input mixer, eurorack synthesizer, and live video improvisation","Composer, Performer","Ted Moore, no-input mixer, eurorack synthesizer, video design"
11/6/2016,,First Lutheran Church,White Bear Lake,MN,Jeremy Johnston,it teaches us that it doesn't exist,Composer,"Jeremy Johnston, feedback cymbal"
11/4/2016,,Reverie,Minneapolis,MN,Ars Electroacoustica,improvisation,improvisor,"Ted Moore, laptop; Adam Zahller, recorder"
10/29/2016,,CMS Conference,Santa Fe,NM,Pink Noise Project,improvisation,Laptop Improviser,"Binary Canary (Ted Moore, laptop; Kyle Hutchins, woodwinds)"
10/27/2016,,University of New Mexico,Albuquerque,NM,Pink Noise Project,improvisation,Laptop Improviser,"Binary Canary (Ted Moore, laptop; Kyle Hutchins, woodwinds)"
10/26/2016,,Fort Lewis College,Durango,CO,Pink Noise Project,improvisation,Laptop Improviser,"Binary Canary (Ted Moore, laptop; Kyle Hutchins, woodwinds)"
10/24/2016,,Metropolitan State University,Denver,CO,Pink Noise Project,improvisation,Laptop Improviser,"Binary Canary (Ted Moore, laptop; Kyle Hutchins, woodwinds)"
10/20/2016,,Pearson Lakes Art Center,Okoboji,IA,Jeremy Johnston,it teaches us that it doesn't exist,Composer,"Jeremy Johnston, feedback cymbal"
10/16/2016,,Bethlehem Lutheran Church,Two Harbors,MN,Jeremy Johnston,it teaches us that it doesn't exist,Composer,"Jeremy Johnston, feedback cymbal"
10/7/2016,10/22/2016,Fresh Oysters Performance Research,Minneapolis,MN,Skewed Visions,The Ballad of Curtis King (recording),Laptop Improviser,"Binary Canary (Ted Moore, laptop; Kyle Hutchins, woodwinds)"
9/16/2016,,Macphail Center for Music,Minneapolis,MN,Ted Moore,APSIS,"Composer, Performer","Ted Moore, laptop & video design; Strains New Music Ensemble (Benjamin Cold, tenor saxophone; Carlynn Savott, cello; Jeremy Johnston, percussion; James DeVoll, flute)"
9/16/2016,,Macphail Center for Music,Minneapolis,MN,Ted Moore,if two things don't fit...,"Composer, Performer","Ted Moore, laptop; Alyssa Anderson, soprano; Benjamin Cold, saxophones"
9/16/2016,,Macphail Center for Music,Minneapolis,MN,Ted Moore,eurorack improvisation,"eurorack improvisor, video designer","Ted Moore, eurorack synthesizer & video design; Sarah Porwoll-Lee, clarinets"
9/13/2016,,Reverie,Minneapolis,MN,Ars Electroacoustica,improvisation,Laptop Improviser,"Ted Moore, laptop; Scott Miller, laptop; Noah Ophoven-Baldwin, trumpet"
6/22/2016,,Walden School,Dublin,NH,Quince Contemporary Vocal Ensemble,only that there's a secret,Composer,"Quince Contemporary Vocal Ensemble (Elizabeth Pearse, soprano; Kayleigh Butcher, mezzo soprano; Amanda DeBoer Bartlett, soprano; Carrie Henneman Shaw, soprano)"
6/7/2016,,National Sawdust,Brooklyn,NY,NYC Electoacoustic Music Festival,improvisation,Laptop Improviser,"Binary Canary (Ted Moore, laptop; Kyle Hutchins, woodwinds)"
5/28/2016,,Fallout Arts,Minneapolis,MN,Ted Moore,FEATHERMUCKER,"Composer, Performer","The Dream Songs Project (Alyssa Anderson, soprano; Joseph Spoelstra, guitar), Ted Moore, laptop"
5/27/2016,,The Riverboat,Minneapolis,MN,Punk Ass Classical,FEATHERMUCKER,"Composer, Performer","The Dream Songs Project (Alyssa Anderson, soprano; Joseph Spoelstra, guitar), Ted Moore, laptop"
5/22/2016,,MacPhail Center for Music,Minneapolis,MN,Ted Moore & Katie Condon,Live Film Score of Berlin: A City Symphony,Laptopist,"Katie Condon, piano; Ted Moore, laptop"
4/24/2016,,Reverie,Minneapolis,MN,Ars Electroacoustica,improvisation,Laptop Improviser,"Ted Moore, laptop; Scott Miller, laptop; Sarah Porwoll-Lee, clarinets; Nick Zielinski, drums"
4/14/2016,,Landmark Center,St. Paul,MN,American Composers Forum,FEATHERMUCKER (excerpt),Composer,"The Dream Songs Project (Alyssa Anderson, mezzo soprano; Joseph Spoelstra, guitar)"
4/10/2016,,Univ. of Wisconsin La Crosse,La Crosse,WI,Univ. of Wisconsin La Crosse,Leviathan,"Composer, Performer","Sarah Porwoll-Lee, bass clarinet; Ted Moore, laptop"
3/25/2016,3/26/2016,Patrick's Cabaret,Minneapolis,MN,Patrick's Cabaret,improvisation,Laptop Improviser,"Binary Canary (Ted Moore, laptop; Kyle Hutchins, woodwinds)"
3/20/2016,,Honey,Minneapolis,MN,Ars Electroacoustica,improvisation,Laptop Improviser,"Ted Moore, laptop; Scott Miller, laptop; Adam Zahller, recorders"
3/15/2016,,Reverie,Minneapolis,MN,Ars Electroacoustica,improvisation,Laptop Improviser,"Ted Moore, laptop; Scott Miller, laptop; Jorrit Dijkstra, saxophone; Nathan Hanson, saxophone"
3/11/2016,,Texas Tech University,Lubbock,TX,North American Saxophone Alliance,improvisation,Laptop Improviser,"Binary Canary (Ted Moore, laptop; Kyle Hutchins, woodwinds)"
3/9/2016,,University of North Texas,Denton,TX,University of North Texas,improvisation,Laptop Improviser,"Binary Canary (Ted Moore, laptop; Kyle Hutchins, woodwinds)"
3/5/2016,,SPACE,St. Paul,MN,LoSo (Ted Moore),APSIS,"Composer, Performer, Video Desiger","Kyle Hutchins, tenor saxophone; James DeVoll, alto flute; Carlynn Savot, cello; Jeremy Johnston, perc.; Ted Moore, laptop"
2/21/2016,,Honey,Minneapolis,MN,Ars Electroacoustica,improvisation,Laptop Improviser,"Ted Moore, laptop; Scott Miller, laptop; Jacqueline Ultan, cello"
2/20/2016,,University of Iowa,Iowa City,IA,Craig Hultgren,The Eye of Horus,Composer,"Craig Hultgren, cello"
2/12/2016,2/26/2016,The Southern Theater,Minneapolis,MN,Savage Umbrella,June,Composer,
2/12/2016,,Punk Ass Classical,Minneapolis,MN,Punk Ass Classical,improvisation,Laptop Improviser,"Binary Canary (Ted Moore, laptop; Kyle Hutchins, woodwinds)"
2/9/2016,,Luther College,Decorah,IA,Craig Hultgren,The Eye of Horus,Composer,"Craig Hultgren, cello"
2/8/2016,,University of Northern Iowa,Cedar Falls,IA,Craig Hultgren,The Eye of Horus,Composer,"Craig Hultgren, cello"
1/29/2016,,St. Ambrose University,Davenport,IA,Craig Hultgren,The Eye of Horus,Composer,"Craig Hultgren, cello"
1/24/2016,,Fallout Arts,Minneapolis,MN,Strains New Music Ensemble,thread fork thread,Composer,"Kyle Hutchins, tenor saxophone; James DeVoll, alto flute; Carlynn Savot, cello; Jeremy Johnston, perc."
1/24/2016,,Dreamland Arts,St. Paul,MN,The Dream Songs Project,FEATHERMUCKER,"Composer, Performer","Ted Moore, laptop; Alyssa Anderson, soprano; Joseph Spoelstra, guitar"
1/23/2016,,Dreamland Arts,St. Paul,MN,Strains New Music Ensemble,thread fork thread,Composer,"Kyle Hutchins, tenor saxophone; James DeVoll, alto flute; Carlynn Savot, cello; Jeremy Johnston, perc."
1/23/2016,,Plymouth Congregational Church,Minneapolis,MN,The Dream Songs Project,FEATHERMUCKER,"Composer, Performer","Ted Moore, laptop; Alyssa Anderson, soprano; Joseph Spoelstra, guitar"
1/22/2016,,James J. Hill House,St. Paul,MN,The Dream Songs Project,FEATHERMUCKER,"Composer, Performer","Ted Moore, laptop; Alyssa Anderson, soprano; Joseph Spoelstra, guitar"
1/17/2016,,The Nicollet,Minneapolis,MN,Ars Electroacoustica,improvisation,Laptop Improviser,"Ted Moore, laptop; Scott Miller, laptop; Dan Lippel, guitar"
1/16/2016,,Zahller Residence,Minneapolis,MN,Ars Electroacoustica,improvisation,Laptop Improviser,"Ted Moore, laptop; Scott Miller, laptop; Dan Lippel, guitar"
